{
  "id": "6-hamburg",
  "type": "FeatureCollection",
  "crs": {
    "type": "name",
    "properties": { "name": "urn:ogc:def:crs:OGC:1.3:CRS84" }
  },
  "bbox": [9.478504, 53.468862, 9.882698, 53.596653],
  "features": [
    {
      "type": "Feature",
      "properties": {
        "id": "1",
        "state": "planning",
        "id_rsv": "6-hamburg",
        "planning_phase": "preliminary",
        "detail_level": "rough",
        "variant": null,
        "discarded": false,
        "description:planning_phase": null,
        "stand": "20.04.2022",
        "length": 57553.85212355369
      },
      "bbox": [9.478504, 53.468862, 9.882698, 53.596653],
      "geometry": {
        "type": "MultiLineString",
        "coordinates": [
          [
            [9.710679, 53.468958],
            [9.713498, 53.470389],
            [9.714139, 53.471781],
            [9.718689, 53.47241],
            [9.723174, 53.47569],
            [9.739226, 53.479218],
            [9.74714, 53.479561],
            [9.746979, 53.487091],
            [9.74762, 53.490199],
            [9.766621, 53.490166],
            [9.794178, 53.494451],
            [9.802175, 53.494135],
            [9.805753, 53.500926],
            [9.811466, 53.513395],
            [9.812013, 53.521358],
            [9.821459, 53.521231],
            [9.82458, 53.525399],
            [9.822015, 53.526237],
            [9.82334, 53.527305],
            [9.831248, 53.530836],
            [9.839449, 53.529023],
            [9.842655, 53.529988],
            [9.843553, 53.531716],
            [9.842869, 53.536594],
            [9.850307, 53.536467],
            [9.864199, 53.534536],
            [9.877269, 53.533634],
            [9.87868, 53.532313],
            [9.878509, 53.520447],
            [9.879834, 53.518363],
            [9.882698, 53.517676],
            [9.87992, 53.516482],
            [9.880988, 53.514753],
            [9.879877, 53.513686],
            [9.874106, 53.512517],
            [9.872311, 53.509339],
            [9.875731, 53.508983],
            [9.877312, 53.502755],
            [9.879877, 53.501636],
            [9.877825, 53.500237],
            [9.877868, 53.498992],
            [9.875303, 53.498534],
            [9.874662, 53.492355],
            [9.867908, 53.489226],
            [9.867438, 53.485793],
            [9.862479, 53.483758],
            [9.860556, 53.481596],
            [9.862454, 53.479899],
            [9.863081, 53.476831],
            [9.85756, 53.47681]
          ],
          [
            [9.478504, 53.596653],
            [9.485662, 53.595232],
            [9.510638, 53.578034],
            [9.521578, 53.569884],
            [9.526584, 53.566489],
            [9.534758, 53.562597],
            [9.540528, 53.559624],
            [9.547191, 53.555709],
            [9.556238, 53.547415],
            [9.558222, 53.54563],
            [9.561153, 53.541357],
            [9.564921, 53.534033],
            [9.565597, 53.527123],
            [9.572276, 53.51342],
            [9.577181, 53.50887],
            [9.585016, 53.506761],
            [9.589015, 53.504651],
            [9.589401, 53.503462],
            [9.591723, 53.503328],
            [9.59427, 53.501717],
            [9.593658, 53.499933],
            [9.602783, 53.496327],
            [9.608974, 53.493584],
            [9.610683, 53.494256],
            [9.613392, 53.493085],
            [9.614682, 53.491647],
            [9.638865, 53.481805],
            [9.656737, 53.474675],
            [9.674664, 53.472304],
            [9.690534, 53.470239],
            [9.706083, 53.468862],
            [9.716171, 53.469091],
            [9.77163, 53.472008],
            [9.795275, 53.473423],
            [9.826802, 53.475155],
            [9.854104, 53.474404],
            [9.854083, 53.476257],
            [9.857442, 53.476743]
          ]
        ]
      }
    }
  ]
}
