{
  "id": "30-baden-wuerttemberg",
  "type": "FeatureCollection",
  "crs": {
    "type": "name",
    "properties": { "name": "urn:ogc:def:crs:OGC:1.3:CRS84" }
  },
  "bbox": [7.591621, 47.546755, 7.87616, 47.591564],
  "features": [
    {
      "type": "Feature",
      "properties": {
        "id": "1",
        "detail_level": "corridor",
        "state": "idea",
        "id_rsv": "30-baden-wuerttemberg",
        "planning_phase": null,
        "variant": "Vorzugstrasse",
        "discarded": false,
        "stand": "07.06.2022",
        "length": 23587.598,
        "description:planning_phase": null
      },
      "bbox": [7.591621, 47.546755, 7.87616, 47.591564],
      "geometry": {
        "type": "MultiLineString",
        "coordinates": [
          [
            [7.87616, 47.591564],
            [7.816078, 47.588554],
            [7.786896, 47.557053],
            [7.729465, 47.546755],
            [7.684833, 47.551158],
            [7.654106, 47.554981],
            [7.591621, 47.554055]
          ]
        ]
      }
    }
  ]
}
