{
  "id": "7-baden-wuerttemberg",
  "type": "FeatureCollection",
  "crs": {
    "type": "name",
    "properties": { "name": "urn:ogc:def:crs:OGC:1.3:CRS84" }
  },
  "bbox": [
    8.34836520128735, 48.9899184354538, 8.47024657436891, 49.0465980479245
  ],
  "features": [
    {
      "type": "Feature",
      "properties": {
        "id": "1",
        "detail_level": "rough",
        "state": "planning",
        "id_rsv": "7-baden-wuerttemberg",
        "planning_phase": "pilot",
        "variant": "Vorzugstrasse",
        "discarded": false,
        "stand": "02.06.2022",
        "length": 23804.959,
        "description:planning_phase": null
      },
      "bbox": [
        8.348365201287349, 48.98991843545378, 8.470246574368907,
        49.046598047924526
      ],
      "geometry": {
        "type": "MultiLineString",
        "coordinates": [
          [
            [8.38046488711068, 48.992129911489585],
            [8.38570498376339, 48.99109839403816],
            [8.390179535045744, 48.99056113690705],
            [8.393192590621052, 48.991291805187046],
            [8.396628333680344, 48.98991843545378],
            [8.417931578177535, 48.99556814875071],
            [8.43627191646201, 49.00020939264515],
            [8.43959200895057, 49.000725059715904],
            [8.44365308385642, 48.99986561163177],
            [8.451578730043638, 48.999263989148666],
            [8.456098313406596, 48.99969372023526],
            [8.460617896769557, 49.00175637784055],
            [8.467541737945528, 49.005477906445925],
            [8.470246574368907, 49.008588321018586],
            [8.464032147244835, 49.01013504594359],
            [8.463172443887752, 49.01271281404379],
            [8.452778220918038, 49.01602075422486],
            [8.440247021032159, 49.018598217577654],
            [8.435956691897754, 49.01969359908819],
            [8.432686748771827, 49.021156083757596],
            [8.430667469338928, 49.0227057739426],
            [8.420813631336525, 49.02821956822046],
            [8.402735297884686, 49.03869785140481],
            [8.403259307549956, 49.041961128184404],
            [8.400115249558333, 49.04385029582643],
            [8.396971191566708, 49.046598047924526],
            [8.392517109411909, 49.046426317866576],
            [8.388637186284948, 49.0463102655777],
            [8.387015007926564, 49.045739391703876],
            [8.378630853282234, 49.04178938211289],
            [8.373976173677455, 49.04102188460852],
            [8.371470752465383, 49.04182695161667],
            [8.369751345751213, 49.042760813019605],
            [8.363434572989382, 49.038526094064274],
            [8.359369404258034, 49.03379716683624],
            [8.356651104119441, 49.029202001024984],
            [8.354753446389456, 49.026383857107135],
            [8.348365201287349, 49.02123460971299],
            [8.349548316859709, 49.01413052960851],
            [8.35442406304204, 49.01242819203766],
            [8.362648558491477, 49.00536582310001],
            [8.366054621315737, 49.002443911392646],
            [8.368593816588312, 48.999932085098855],
            [8.377844838784325, 48.992989493051475],
            [8.38046488711068, 48.992129911489585]
          ]
        ]
      }
    }
  ]
}
