{
  "id": "rs7-nordrhein-westfalen",
  "type": "FeatureCollection",
  "crs": {
    "type": "name",
    "properties": { "name": "urn:ogc:def:crs:OGC:1.3:CRS84" }
  },
  "bbox": [
    6.92869566350497, 51.4646875413971, 6.99574616946811, 51.5223517068917
  ],
  "features": [
    {
      "type": "Feature",
      "properties": {
        "id": "1",
        "id_rsv": "RS7",
        "state": "agreement_process",
        "detail_level": "approximated",
        "variant": "Vorzugstrasse",
        "length": 8791.472,
        "discarded": false,
        "stand": "01.01.2022",
        "planning_phase": null
      },
      "bbox": [
        6.928695663504974, 51.46468754139711, 6.995746169468115,
        51.52235170689174
      ],
      "geometry": {
        "type": "MultiLineString",
        "coordinates": [
          [
            [6.995317987347466, 51.46468754139711],
            [6.995746169468115, 51.46595786410668],
            [6.99530828866908, 51.46850753768828],
            [6.993579666473902, 51.46985368010919],
            [6.990880637001057, 51.471202928917414],
            [6.989164594839976, 51.47200724059371],
            [6.98920707346251, 51.47419252932494],
            [6.987436414383535, 51.475183032802455],
            [6.98576639137093, 51.4760024773482],
            [6.985328619846836, 51.4770013650282],
            [6.985120387086313, 51.478721953545275],
            [6.984766786487432, 51.48031016863496],
            [6.983926489257175, 51.481346736013144],
            [6.98267212600974, 51.48234087846727],
            [6.980952584172551, 51.48316145103926],
            [6.980201608512011, 51.483799981769984],
            [6.980242879077893, 51.484412856942456],
            [6.980577609447667, 51.48548150005579],
            [6.978748681290141, 51.48585831845969],
            [6.977311320120495, 51.48633560788306],
            [6.975334851110468, 51.486973085945486],
            [6.971086963634238, 51.48844708372611],
            [6.967285999060998, 51.48874653661931],
            [6.963909064177592, 51.48969968384807],
            [6.960783043846468, 51.49106591262747],
            [6.957256608847318, 51.49284177913748],
            [6.954766025785334, 51.495636681935665],
            [6.952621725869959, 51.497223765193134],
            [6.95050616853097, 51.49869593176587],
            [6.950298831458943, 51.49974161688226],
            [6.949929458326174, 51.50078403628821],
            [6.948781297542009, 51.502230397553525],
            [6.947481580535127, 51.5029695473243],
            [6.94441695200378, 51.504022634444],
            [6.943057555179689, 51.5046640894481],
            [6.942651352955711, 51.505021523439495],
            [6.943414212611864, 51.50657163186298],
            [6.944032175341705, 51.50779872047897],
            [6.944637487394316, 51.508539196498226],
            [6.944821600336352, 51.509173078140975],
            [6.942434680082086, 51.51084003496962],
            [6.939348950086394, 51.511883594681954],
            [6.936272090965772, 51.51414463734935],
            [6.932185816349353, 51.5153144160383],
            [6.930680037442221, 51.51766487536089],
            [6.929479244234013, 51.521077254492965],
            [6.928695663504974, 51.52235170689174]
          ]
        ]
      }
    }
  ]
}
