{
  "type": "FeatureCollection",
  "id": "3-nordrhein-westfalen",
  "crs": {
    "type": "name",
    "properties": { "name": "urn:ogc:def:crs:OGC:1.3:CRS84" }
  },
  "bbox": [
    6.95960216568961, 50.776404511097, 7.16006736458641, 50.9382521373113
  ],
  "features": [
    {
      "type": "Feature",
      "properties": {
        "id": "1",
        "length": 33738.34205881348,
        "detail_level": "corridor",
        "id_rsv": "3-nordrhein-westfalen",
        "state": "agreement_process",
        "planning_phase": null,
        "variant": "Vorzugstrasse",
        "discarded": false,
        "stand": "27.06.2022",
        "description:planning_phase": null
      },
      "bbox": [
        6.959602165689605, 50.776404511096956, 7.160067364586408,
        50.938252137311288
      ],
      "geometry": {
        "type": "MultiLineString",
        "coordinates": [
          [
            [6.959602165689605, 50.938252137311288],
            [6.974668976816877, 50.932458543597875],
            [6.986926721462797, 50.912175281291105],
            [7.016038864996857, 50.898970312774509],
            [7.047193965971898, 50.895749020544017],
            [7.059962449978062, 50.885117175140898],
            [7.040554354288689, 50.863201477113613],
            [7.034936221325982, 50.856753722237961],
            [7.034425481965733, 50.830631196913451],
            [7.043108051089926, 50.805139582420551],
            [7.054344317015354, 50.786415360990851],
            [7.075795370145713, 50.776404511096956]
          ],
          [
            [7.040554354288689, 50.863201477113613],
            [7.086010157350644, 50.857720942307317],
            [7.160067364586408, 50.814821581126829]
          ]
        ]
      }
    }
  ]
}
