{
  "id": "7-hamburg",
  "type": "FeatureCollection",
  "crs": {
    "type": "name",
    "properties": { "name": "urn:ogc:def:crs:OGC:1.3:CRS84" }
  },
  "bbox": [
    9.71232231210928, 53.2810600220712, 10.0178981708302, 53.4370070968245
  ],
  "features": [
    {
      "type": "Feature",
      "properties": {
        "id": "1",
        "state": "idea",
        "id_rsv": "7-hamburg",
        "planning_phase": null,
        "detail_level": "corridor",
        "variant": null,
        "discarded": false,
        "description:planning_phase": null,
        "stand": "20.04.2022",
        "length": 27463.691575129324
      },
      "bbox": [
        9.712322312109285, 53.28106002207117, 10.017898170830223,
        53.43700709682448
      ],
      "geometry": {
        "type": "MultiLineString",
        "coordinates": [
          [
            [9.712322312109285, 53.28106002207117],
            [9.881338510358978, 53.32923764837392],
            [10.017898170830223, 53.43700709682448]
          ]
        ]
      }
    }
  ]
}
