{
  "id": "1_bayern",
  "type": "FeatureCollection",
  "crs": {
    "type": "name",
    "properties": { "name": "urn:ogc:def:crs:OGC:1.3:CRS84" }
  },
  "bbox": [11.5785367032267, 48.1462389314442, 11.669749, 48.270993],
  "features": [
    {
      "type": "Feature",
      "properties": {
        "id": "1",
        "detail_level": "corridor",
        "id_rsv": "1-bayern",
        "state": "planning",
        "planning_phase": "preliminary",
        "variant": "Vorzugstrasse",
        "length": 21263.535,
        "stand": "27.06.2022",
        "discarded": false
      },
      "bbox": [11.57853670322673, 48.14623893144424, 11.669749, 48.270993],
      "geometry": {
        "type": "MultiLineString",
        "coordinates": [
          [
            [11.602208, 48.249168],
            [11.592273, 48.270993]
          ],
          [
            [11.57853670322673, 48.14623893144424],
            [11.58598476192743, 48.16313272427922],
            [11.58275726982379, 48.1912766856319],
            [11.587206, 48.221998],
            [11.597171, 48.229257],
            [11.60213, 48.249231],
            [11.613737, 48.250615],
            [11.630063, 48.249519],
            [11.631159, 48.252199],
            [11.637832, 48.251471],
            [11.647592, 48.260535],
            [11.658298, 48.262527],
            [11.669749, 48.260954]
          ],
          [
            [11.658308, 48.262574],
            [11.665047, 48.27048]
          ]
        ]
      }
    }
  ]
}
