{
  "id": "frm2-hessen",
  "type": "FeatureCollection",
  "crs": {
    "type": "name",
    "properties": { "name": "urn:ogc:def:crs:OGC:1.3:CRS84" }
  },
  "bbox": [
    8.48432601166193, 49.9249538847202, 8.59380326592056, 50.0230387454606
  ],
  "features": [
    {
      "type": "Feature",
      "properties": {
        "id": "1",
        "id_rsv": "frm2-hessen",
        "state": "agreement_process",
        "planning_phase": null,
        "detail_level": "approximated",
        "variant": "Vorzugstrasse",
        "length": 14269.568252915209,
        "discarded": false,
        "description:planning_phase": "Politische Beschlüsse",
        "stand": "07.06.2022"
      },
      "bbox": [
        8.48432601166193, 49.9249538847202, 8.593803265920556, 50.01876940842946
      ],
      "geometry": {
        "type": "MultiLineString",
        "coordinates": [
          [
            [8.593803265920556, 50.01876940842946],
            [8.592133782120655, 50.017522989996785],
            [8.580739671586423, 50.01595918675786],
            [8.577310376182917, 50.013826645772326],
            [8.578416600506628, 50.012404899202316],
            [8.577420998615288, 50.0122627222318],
            [8.573549213482297, 50.00664639543157],
            [8.56834995916085, 49.99363390208648],
            [8.564810041324971, 49.98076015719161],
            [8.566026888081055, 49.980333344212255],
            [8.561270123489095, 49.973005797624225],
            [8.551867216737543, 49.965961764199854],
            [8.549986635387233, 49.9653925043568],
            [8.549322900793005, 49.9640404852481],
            [8.533611664302683, 49.951474354727246],
            [8.524590804095919, 49.94840624464004],
            [8.505646997661714, 49.9452550092118],
            [8.499203526085452, 49.941523016419076],
            [8.49095588246784, 49.93322866396914],
            [8.489409449289537, 49.932150293278205],
            [8.487839766471529, 49.93006827058143],
            [8.487158385959225, 49.92802258728178],
            [8.485785328665603, 49.926084756896174],
            [8.48432601166193, 49.9249538847202]
          ]
        ]
      }
    },
    {
      "type": "Feature",
      "properties": {
        "id": "2",
        "id_rsv": "frm2-hessen",
        "state": "agreement_process",
        "planning_phase": null,
        "detail_level": "approximated",
        "variant": "Alternativetrasse",
        "length": 10455.501545657264,
        "discarded": false,
        "description:planning_phase": "Politische Beschlüsse",
        "stand": "07.06.2022"
      },
      "bbox": [
        8.538207154585635, 49.96539250435681, 8.592133782120653,
        50.02303874546058
      ],
      "geometry": {
        "type": "MultiLineString",
        "coordinates": [
          [
            [8.577310376182917, 50.013826645772326],
            [8.575960818290648, 50.01401546703647],
            [8.562731771709378, 50.014603993372845],
            [8.559271867218891, 50.02140421926354],
            [8.5582542482511, 50.0222541798267],
            [8.556117248418744, 50.02290798541142],
            [8.553878486689603, 50.02297336548051],
            [8.552453820134698, 50.022711844670326],
            [8.548790391850654, 50.022711844670326],
            [8.538207154585635, 50.02303874546058]
          ],
          [
            [8.592133782120653, 50.017522989996785],
            [8.573925580355068, 49.99059935104547],
            [8.573213247077614, 49.98595401734761],
            [8.571890342419488, 49.986542887295926],
            [8.566293438096643, 49.97875613544398],
            [8.567311057064432, 49.97685833264067],
            [8.565275819128853, 49.97640023109379],
            [8.564665247748179, 49.976662003940326],
            [8.561270123489095, 49.973005797624225]
          ],
          [
            [8.549986635387233, 49.96539250435681],
            [8.550418582199118, 49.96854638346295],
            [8.555934251800092, 49.96900864335661],
            [8.555710200831625, 49.97168807632614],
            [8.558356010147884, 49.971131749824536],
            [8.558557206756422, 49.970973566348526]
          ]
        ]
      }
    }
  ]
}
