{
  "id": "9-nordrhein-westfalen",
  "type": "FeatureCollection",
  "crs": {
    "type": "name",
    "properties": { "name": "urn:ogc:def:crs:OGC:1.3:CRS84" }
  },
  "bbox": [
    6.89780481238658, 51.0820659021538, 6.91056998364509, 51.1316965665994
  ],
  "features": [
    {
      "type": "Feature",
      "properties": {
        "id": "1",
        "id_rsv": "RS-Monheim",
        "state": "planning",
        "detail_level": "approximated",
        "variant": "Vorzugstrasse",
        "length": 5965.901,
        "discarded": false,
        "stand": "01.01.2022",
        "planning_phase": "approval"
      },
      "bbox": [
        6.897804812386578, 51.08206590215384, 6.910569983645095,
        51.1316965665994
      ],
      "geometry": {
        "type": "MultiLineString",
        "coordinates": [
          [
            [6.905242726198005, 51.090701684820736],
            [6.90546394168824, 51.09026205268998],
            [6.90595186308774, 51.08900082010046],
            [6.906572608742192, 51.08747057310082],
            [6.907036216869629, 51.08636093757028],
            [6.907672816759753, 51.08486344449914],
            [6.908232888352762, 51.08390746506408],
            [6.908652937623841, 51.08338316267444],
            [6.910569983645095, 51.08206590215384]
          ],
          [
            [6.904303230093658, 51.09273157119605],
            [6.905171823242627, 51.092946773536724],
            [6.904821455088189, 51.094363980646435],
            [6.904396193121256, 51.09611522017951],
            [6.903962426074718, 51.09802925620625],
            [6.903596255915586, 51.09942710468524],
            [6.902952944841452, 51.10264681607032],
            [6.902799175551208, 51.103653018689585],
            [6.903566544801289, 51.1048788313432],
            [6.903341046127748, 51.10555673119872],
            [6.902653502011457, 51.106866914561465],
            [6.902367368254189, 51.108537027552245],
            [6.902391032640228, 51.110351506807305],
            [6.901285837441725, 51.112690253243144],
            [6.901013995197223, 51.11421172673333],
            [6.900894409751774, 51.11519895875351],
            [6.899751609162188, 51.11563318750906],
            [6.899547104646581, 51.116631404037626],
            [6.899302526525802, 51.11792956032378],
            [6.898918119265987, 51.119676038012514],
            [6.898809114426382, 51.12032535417975],
            [6.898821542612012, 51.12063451195748],
            [6.898700409509729, 51.12119973122106],
            [6.89892217596903, 51.124439201474026],
            [6.898514793158009, 51.125795863877265],
            [6.898076371753042, 51.12732599836189],
            [6.897804812386578, 51.12838994869791],
            [6.897847434196651, 51.12852902744689],
            [6.898317539235318, 51.128921432661066],
            [6.900050251434949, 51.129063035804236],
            [6.903606393506402, 51.12967544729785],
            [6.905642481308579, 51.130717922605385],
            [6.907535906844175, 51.1316965665994]
          ]
        ]
      }
    },
    {
      "type": "Feature",
      "properties": {
        "id": "2",
        "id_rsv": "RS-Monheim",
        "state": "done",
        "detail_level": "exact",
        "variant": "Vorzugstrasse",
        "length": 243.466,
        "discarded": false,
        "stand": "01.01.2022",
        "planning_phase": null
      },
      "bbox": [
        6.90444849102231, 51.090690529267206, 6.905249306957381,
        51.09281958697332
      ],
      "geometry": {
        "type": "MultiLineString",
        "coordinates": [
          [
            [6.905249306957381, 51.090690529267206],
            [6.905078788841004, 51.09109849037274],
            [6.904554101588345, 51.09247076079983],
            [6.90444849102231, 51.09281958697332]
          ]
        ]
      }
    }
  ]
}
