{
  "id": "rs3-baden-wuerttemberg",
  "type": "FeatureCollection",
  "crs": {
    "type": "name",
    "properties": { "name": "urn:ogc:def:crs:OGC:1.3:CRS84" }
  },
  "bbox": [9.159626, 49.118207, 9.21516722114723, 49.232695],
  "features": [
    {
      "type": "Feature",
      "properties": {
        "id": "1",
        "detail_level": "rough",
        "state": "planning",
        "id_rsv": "RS3",
        "planning_phase": "design",
        "variant": "Trasse 1.1  \"Neckar\"",
        "discarded": false,
        "stand": "07.06.2022",
        "length": 17596.977,
        "description:planning_phase": null
      },
      "bbox": [9.159626, 49.118207, 9.215167221147231, 49.232695],
      "geometry": {
        "type": "MultiLineString",
        "coordinates": [
          [
            [9.17031, 49.23039],
            [9.175615, 49.231897],
            [9.178499, 49.232695],
            [9.191214, 49.231478],
            [9.20259258755699, 49.219082812796785],
            [9.205339986492673, 49.214527297361],
            [9.207981716238523, 49.21293967060097],
            [9.209355415706364, 49.20921199868233],
            [9.21220848383188, 49.20631250397591],
            [9.212631160591215, 49.20417229167158],
            [9.211046122743708, 49.20092727697101],
            [9.213476514109887, 49.197267749625674],
            [9.214744544387894, 49.19395322704158],
            [9.2150615519574, 49.19036224360404],
            [9.215167221147231, 49.186563804385074],
            [9.21379352167939, 49.18421553246523],
            [9.20787604704869, 49.18290321432362],
            [9.202803925936657, 49.18055476868311],
            [9.203526, 49.156431],
            [9.196059, 49.126888],
            [9.190165, 49.12135],
            [9.174522, 49.120316],
            [9.173749, 49.12273],
            [9.159626, 49.118207]
          ]
        ]
      }
    }
  ]
}
